{
  "schemaVersion": "1.0.0",
  "launchId": "prelaunch:dynamic-supply-burn-fixture",
  "category": "custom",
  "chainId": 1,
  "token": {
    "address": "0x1313131313131313131313131313131313131313",
    "identityStatus": "complete",
    "name": "Dynamic Supply Fixture",
    "symbol": "DEFLATE",
    "decimals": 18,
    "totalSupplyRaw": null,
    "supplyStatus": "unavailable",
    "supplyAsOfBlock": null,
    "metadata": {
      "description": "A prelaunch fixture for variable supply and sell-triggered burns.",
      "imageUrl": null,
      "links": null,
      "trustStatus": "creator-declared"
    }
  },
  "launch": {
    "status": "prelaunch",
    "origin": "public-submission",
    "modelId": "open-custom",
    "modelVersion": null,
    "publicSubmission": true,
    "creatorAddress": "0x7777777777777777777777777777777777777777",
    "transactionHash": null,
    "blockNumber": null,
    "blockHash": null,
    "logIndex": null,
    "timestamp": null,
    "finality": null
  },
  "verification": {
    "sourceId": "fixture/dynamic-supply-burn",
    "launcherAddress": null,
    "registryAddress": null,
    "provenanceStatus": "prelaunch",
    "sourceUrl": "https://github.com/example/dynamic-supply-burn"
  },
  "capabilities": [
    {
      "id": "dynamic-supply",
      "version": "1",
      "status": "conditional",
      "parameters": {
        "supplyModel": "exponential-deflation"
      }
    },
    {
      "id": "sell-triggered-burn",
      "version": "1",
      "status": "conditional",
      "parameters": {
        "burnSource": "sold-tokens"
      }
    },
    {
      "id": "buyback-and-burn",
      "version": null,
      "status": "conditional",
      "parameters": {}
    }
  ],
  "markets": [],
  "fees": [
    {
      "kind": "programmable-platform",
      "ratePpm": 1000,
      "rateBps": 10,
      "recipient": "0x4957f49620AFf3Adbbe8195a4f633E49cc93376c",
      "chargeMode": "added-on-top",
      "basis": "official-market-volume",
      "assetAddress": null,
      "verificationStatus": "prelaunch"
    }
  ],
  "extensions": {
    "example/scenario": "Dynamic supply is descriptive; the current supply remains unavailable until observed onchain."
  }
}
