{
  "schemaVersion": "2.0.0",
  "launchId": "eip155:1:0x8888888888888888888888888888888888888888",
  "category": "custom",
  "chainId": 1,
  "token": {
    "address": "0x8888888888888888888888888888888888888888",
    "identityStatus": "complete",
    "name": "Custom No Market Fixture",
    "symbol": "NOMARKET",
    "decimals": 18,
    "totalSupplyRaw": null,
    "supplyStatus": "unavailable",
    "supplyAsOfBlock": null,
    "metadata": {
      "description": "A prelaunch Custom fixture with no market.",
      "imageUrl": null,
      "links": null,
      "trustStatus": "creator-declared"
    }
  },
  "launch": {
    "status": "live",
    "origin": "partner-provider",
    "modelId": "custom-hook",
    "modelVersion": "1",
    "publicSubmission": true,
    "creatorAddress": "0x7777777777777777777777777777777777777777",
    "transactionHash": "0xdddddddddddddddddddddddddddddddddddddddddddddddddddddddddddddddd",
    "blockNumber": "25690000",
    "blockHash": "0xeeeeeeeeeeeeeeeeeeeeeeeeeeeeeeeeeeeeeeeeeeeeeeeeeeeeeeeeeeeeeeee",
    "logIndex": 7,
    "timestamp": "2026-08-06T00:00:00.000Z",
    "finality": "finalized"
  },
  "verification": {
    "sourceId": "custom-registry/example-provider/example-template/1",
    "launcherAddress": "0x6666666666666666666666666666666666666666",
    "registryAddress": "0x9999999999999999999999999999999999999999",
    "provenanceStatus": "verified",
    "sourceUrl": "https://etherscan.io/tx/0xdddddddddddddddddddddddddddddddddddddddddddddddddddddddddddddddd"
  },
  "capabilities": [
    {
      "id": "dynamic-supply",
      "version": "1",
      "status": "conditional",
      "parameters": {
        "programmable/supply-model": "exponential-deflation"
      }
    },
    {
      "id": "game-rewards",
      "version": null,
      "status": "conditional",
      "parameters": {
        "programmable/reward-trigger": "verified-game-outcome"
      }
    }
  ],
  "markets": [],
  "fees": [
    {
      "kind": "programmable-platform",
      "ratePpm": 1000,
      "rateBps": 10,
      "recipient": "0x4957f49620AFf3Adbbe8195a4f633E49cc93376c",
      "chargeMode": "added-on-top",
      "basis": "official-market-volume",
      "assetAddress": null,
      "verificationStatus": "verified"
    }
  ],
  "extensions": {
    "example/display-note": "No market exists yet; do not fabricate pool, price, liquidity, or volume.",
    "programmable/classification": {
      "namespace": "programmable",
      "category": "custom",
      "label": "Programmable Custom",
      "basis": "programmable-custom-registry-event"
    },
    "programmable/provider": {
      "providerId": "example-provider",
      "factoryAddress": "0x6666666666666666666666666666666666666666",
      "templateId": "example-template",
      "templateVersion": "1",
      "configurationHash": "0xffffffffffffffffffffffffffffffffffffffffffffffffffffffffffffffff"
    }
  }
}
